{
  "schema_version": "1.0.0",
  "review_id": "review-01",
  "reviewer_invocation_id": "33333333-3333-4333-8333-333333333333",
  "producer_invocation_ids": [
    "22222222-2222-4222-8222-222222222222"
  ],
  "scope_digest": "0000000000000000000000000000000000000000000000000000000000000000",
  "input_artifact_refs": [
    "artifact:git-diff"
  ],
  "independence": {
    "fresh_context": true,
    "same_model_as_producer": "unknown",
    "same_harness_as_producer": false,
    "implementation_rationale_visible_before_findings": false,
    "human_reviewer": false
  },
  "verdict": "approved",
  "findings": [],
  "origin": "imported"
}
